{
  "as_of": "2026-08-28",
  "asset_type": "stock",
  "attribution": {
    "api_documentation_url": "https://openapi.twse.com.tw/v1/swagger.json",
    "license_name": "政府資料開放授權條款－第1版",
    "license_url": "https://data.gov.tw/license",
    "publisher": "金融監督管理委員會證券期貨局／臺灣證券交易所",
    "statement": "金融監督管理委員會證券期貨局／臺灣證券交易所（2026）開放資料；依政府資料開放授權條款－第1版使用。",
    "terms_url": "https://www.twse.com.tw/zh/terms/use.html"
  },
  "automated_refresh_enabled": false,
  "collection_policy": {
    "basis": "Only documented OpenAPI endpoints tied to OGL datasets are collected; generic TWSE/MOPS HTML crawling is excluded.",
    "html_scraping": false,
    "interface": "documented_openapi",
    "minimum_interval_seconds": 2,
    "robots_status": "not_published_404_checked_2026-08-28",
    "robots_url": "https://openapi.twse.com.tw/robots.txt",
    "user_agent": "StockmarketAgent/0.3 (+https://github.com/trionnemesis/StockmarketAgent; research-only)"
  },
  "coverage": {
    "available_fact_groups": [
      "market_session",
      "valuation",
      "monthly_revenue",
      "quarterly_income",
      "balance_sheet"
    ],
    "gaps": [
      "immutable_revision_history",
      "full_eod_history",
      "benchmark_return_series",
      "corporate_action_history"
    ],
    "not_applicable_fact_groups": [
      "fund_profile"
    ]
  },
  "evidence_assessment": {
    "contrary_evidence": [
      "目前只保存最新快照，缺少完整修訂與更正歷史，不能作為 PIT 趨勢證據。",
      "單日行情與未基準化估值不足以支持方向性投資結論。"
    ],
    "invalidation_conditions": [
      "代號、資產類型或來源綁定不一致時，整份快照失效。",
      "官方後續修訂改變已保存事實時，必須以新版本取代並保留修訂紀錄。",
      "資源日期晚於取得時間、必要紀錄不是唯一一筆或契約驗證失敗時，拒絕發布。"
    ],
    "scope": "data_quality_context_only",
    "supporting_evidence": [
      "官方 EOD 單一代號紀錄已通過日期、OHLC、成交量與來源雜湊驗證。",
      "估值、月營收與適用產業別的季度財務皆有同代號官方紀錄。"
    ],
    "used_in_signal": false
  },
  "facts": {
    "balance_sheet": {
      "book_value_per_share_twd": 265.77,
      "currency": "TWD",
      "liabilities_to_assets_percent": 45.06,
      "period": "2026-Q2",
      "published_date": "2026-08-28",
      "source_resource_id": "balance_sheet",
      "statement_type": "general_industry",
      "total_assets_twd_million": 787448.372,
      "total_equity_twd_million": 432641.7,
      "total_liabilities_twd_million": 354806.672,
      "unit": "million"
    },
    "market_session": {
      "change": -80.0,
      "close": 3865.0,
      "currency": "TWD",
      "date": "2026-08-27",
      "high": 4005.0,
      "low": 3865.0,
      "open": 4005.0,
      "source_resource_id": "eod_prices",
      "trade_value_twd": 22369214695,
      "transaction_count": 43578,
      "volume_shares": 5702912
    },
    "monthly_revenue": {
      "audit_status": "company_reported_unaudited",
      "currency": "TWD",
      "month_over_month_percent": -16.44,
      "period": "2026-07",
      "previous_month_twd_million": 58011.756,
      "prior_year_month_twd_million": 43220.164,
      "published_date": "2026-08-17",
      "revenue_twd_million": 48474.93,
      "source_resource_id": "monthly_revenue",
      "unit": "million",
      "year_over_year_percent": 12.16,
      "year_to_date_twd_million": 349808.051,
      "year_to_date_yoy_percent": 0.84
    },
    "quarterly_income": {
      "basic_eps_twd": 30.44,
      "currency": "TWD",
      "gross_margin_percent": 46.25,
      "gross_profit_twd_million": 139362.969,
      "net_income_parent_twd_million": 48488.714,
      "net_margin_parent_percent": 16.09,
      "operating_income_twd_million": 45758.626,
      "operating_margin_percent": 15.19,
      "period": "2026-Q2",
      "period_scope": "year_to_date",
      "pre_tax_income_twd_million": 54981.079,
      "published_date": "2026-08-28",
      "revenue_twd_million": 301333.121,
      "source_resource_id": "quarterly_income",
      "statement_type": "general_industry",
      "unit": "million"
    },
    "valuation": {
      "date": "2026-08-27",
      "dividend_yield_percent": 1.38,
      "pb_ratio": 14.54,
      "pe_ratio": 63.83,
      "source_resource_id": "valuation"
    }
  },
  "fetched_at": "2026-08-28T05:56:32Z",
  "instrument_id": "TW:STOCK:2454",
  "mode": "observed_research_snapshot",
  "name_zh": "聯發科",
  "normalization": {
    "financial_display_unit": "TWD millions",
    "financial_source_unit": "TWD thousands",
    "ratio_rounding_decimals": 2,
    "roc_calendar": "Gregorian year = ROC year + 1911"
  },
  "resources": [
    {
      "content_sha256": "b95e5681a069021aef4efb42b40c315748687895d3b913cbd7b1a18b371796cb",
      "dataset_url": "https://data.gov.tw/dataset/11549",
      "endpoint": "https://openapi.twse.com.tw/v1/exchangeReport/STOCK_DAY_ALL",
      "etag": "\"6a90aa2c-4dcae\"",
      "last_modified": "Thu, 27 Aug 2026 21:20:44 GMT",
      "observed_at": "2026-08-27",
      "raw_retained": false,
      "records_received": 1377,
      "resource_id": "eod_prices",
      "source_id": "TWSE_OGL_EOD"
    },
    {
      "content_sha256": "5bd596dbcfacc85a5f24338520ec0c1b1435f8f668629d64d8d663349fa8eca7",
      "dataset_url": "https://data.gov.tw/dataset/11547",
      "endpoint": "https://openapi.twse.com.tw/v1/exchangeReport/BWIBBU_ALL",
      "etag": "\"6a90aa21-1c6ef\"",
      "last_modified": "Thu, 27 Aug 2026 21:20:33 GMT",
      "observed_at": "2026-08-27",
      "raw_retained": false,
      "records_received": 1081,
      "resource_id": "valuation",
      "source_id": "TWSE_OGL_EOD"
    },
    {
      "content_sha256": "56076345ef920828d7e2cca0a1488833e5bebf5cac12f0a8809a47d8f6c2e36e",
      "dataset_url": "https://data.gov.tw/dataset/18420",
      "endpoint": "https://openapi.twse.com.tw/v1/opendata/t187ap05_L",
      "etag": "\"6a90ab14-9393a\"",
      "last_modified": "Thu, 27 Aug 2026 21:24:36 GMT",
      "observed_at": "2026-08-17",
      "raw_retained": false,
      "records_received": 1085,
      "resource_id": "monthly_revenue",
      "source_id": "TWSE_OGL_FINANCIALS"
    },
    {
      "content_sha256": "6711129e2d34d77e0704003246bdd601ae8f105945478033457f6af7102e45bf",
      "dataset_url": "https://data.gov.tw/dataset/91998",
      "endpoint": "https://openapi.twse.com.tw/v1/opendata/t187ap06_L_ci",
      "etag": "\"6a90ac1d-14fa7b\"",
      "last_modified": "Thu, 27 Aug 2026 21:29:01 GMT",
      "observed_at": "2026-08-28",
      "raw_retained": false,
      "records_received": 1017,
      "resource_id": "quarterly_income",
      "source_id": "TWSE_OGL_FINANCIALS"
    },
    {
      "content_sha256": "1a8a1d7313545176da9abd464bf84597d2ba583b8d2f4d9e3379fb9e34179265",
      "dataset_url": "https://data.gov.tw/dataset/94831",
      "endpoint": "https://openapi.twse.com.tw/v1/opendata/t187ap07_L_ci",
      "etag": "\"6a90ac36-d3a26\"",
      "last_modified": "Thu, 27 Aug 2026 21:29:26 GMT",
      "observed_at": "2026-08-28",
      "raw_retained": false,
      "records_received": 1017,
      "resource_id": "balance_sheet",
      "source_id": "TWSE_OGL_FINANCIALS"
    }
  ],
  "schema_version": "1.1.0",
  "slug": "mediatek",
  "symbol": "2454",
  "used_in_signal": false,
  "warnings": [
    "Point-in-time revision history is incomplete.",
    "Snapshot facts and evidence assessment are not used to calculate or upgrade research attitudes.",
    "No automatic refresh schedule is enabled."
  ]
}
