{
  "as_of": "2026-08-27",
  "asset_type": "etf",
  "attribution": {
    "api_documentation_url": "https://openapi.twse.com.tw/v1/swagger.json",
    "license_name": "政府資料開放授權條款－第1版",
    "license_url": "https://data.gov.tw/license",
    "publisher": "金融監督管理委員會證券期貨局／臺灣證券交易所",
    "statement": "金融監督管理委員會證券期貨局／臺灣證券交易所（2026）開放資料；依政府資料開放授權條款－第1版使用。",
    "terms_url": "https://www.twse.com.tw/zh/terms/use.html"
  },
  "automated_refresh_enabled": false,
  "collection_policy": {
    "basis": "Only documented OpenAPI endpoints tied to OGL datasets are collected; generic TWSE/MOPS HTML crawling is excluded.",
    "html_scraping": false,
    "interface": "documented_openapi",
    "minimum_interval_seconds": 2,
    "robots_status": "not_published_404_checked_2026-08-28",
    "robots_url": "https://openapi.twse.com.tw/robots.txt",
    "user_agent": "StockmarketAgent/0.3 (+https://github.com/trionnemesis/StockmarketAgent; research-only)"
  },
  "coverage": {
    "available_fact_groups": [
      "market_session",
      "fund_profile"
    ],
    "gaps": [
      "immutable_revision_history",
      "full_eod_history",
      "pit_holdings",
      "nav_and_premium_discount_history",
      "benchmark_return_series"
    ],
    "not_applicable_fact_groups": [
      "valuation",
      "monthly_revenue",
      "quarterly_income",
      "balance_sheet"
    ]
  },
  "evidence_assessment": {
    "contrary_evidence": [
      "ETF 不適用公司月營收與公司財務報表，不能以個股基本面欄位比較。",
      "尚缺 PIT 持股、NAV、折溢價與可再發布的 benchmark 報酬序列。"
    ],
    "invalidation_conditions": [
      "代號、資產類型或來源綁定不一致時，整份快照失效。",
      "官方後續修訂改變已保存事實時，必須以新版本取代並保留修訂紀錄。",
      "資源日期晚於取得時間、必要紀錄不是唯一一筆或契約驗證失敗時，拒絕發布。"
    ],
    "scope": "data_quality_context_only",
    "supporting_evidence": [
      "官方 EOD 單一代號紀錄已通過日期、OHLC、成交量與來源雜湊驗證。",
      "基金代號、基金類型、上市日與追蹤指數皆有同代號官方紀錄。"
    ],
    "used_in_signal": false
  },
  "facts": {
    "fund_profile": {
      "custom_index_or_disclosure_required": true,
      "fund_type": "國內成分證券指數股票型基金",
      "inception_date": "2020-07-10",
      "includes_foreign_constituents": false,
      "issued_units": 18867790000,
      "listing_date": "2020-07-20",
      "official_name": "國泰台灣高股息傘型證券投資信託基金之台灣ESG永續高股息ETF證券投資信託基金",
      "profile_date": "2026-08-27",
      "source_resource_id": "fund_profile",
      "tracking_index_name": "MSCI臺灣ESG永續高股息精選30指數"
    },
    "market_session": {
      "change": -0.11,
      "close": 32.71,
      "currency": "TWD",
      "date": "2026-08-27",
      "high": 33.02,
      "low": 32.71,
      "open": 32.9,
      "source_resource_id": "eod_prices",
      "trade_value_twd": 891369723,
      "transaction_count": 17610,
      "volume_shares": 27062007
    }
  },
  "fetched_at": "2026-08-28T05:56:32Z",
  "instrument_id": "TW:ETF:00878",
  "mode": "observed_research_snapshot",
  "name_zh": "國泰永續高股息",
  "normalization": {
    "financial_display_unit": "TWD millions",
    "financial_source_unit": "TWD thousands",
    "ratio_rounding_decimals": 2,
    "roc_calendar": "Gregorian year = ROC year + 1911"
  },
  "resources": [
    {
      "content_sha256": "b95e5681a069021aef4efb42b40c315748687895d3b913cbd7b1a18b371796cb",
      "dataset_url": "https://data.gov.tw/dataset/11549",
      "endpoint": "https://openapi.twse.com.tw/v1/exchangeReport/STOCK_DAY_ALL",
      "etag": "\"6a90aa2c-4dcae\"",
      "last_modified": "Thu, 27 Aug 2026 21:20:44 GMT",
      "observed_at": "2026-08-27",
      "raw_retained": false,
      "records_received": 1377,
      "resource_id": "eod_prices",
      "source_id": "TWSE_OGL_EOD"
    },
    {
      "content_sha256": "66f404dd60dff231d68ee74f33a85d96b4b4b46513779a77cb25f58037de0cae",
      "dataset_url": "https://data.gov.tw/dataset/157399",
      "endpoint": "https://openapi.twse.com.tw/v1/opendata/t187ap47_L",
      "etag": "\"6a90acbd-52b59\"",
      "last_modified": "Thu, 27 Aug 2026 21:31:41 GMT",
      "observed_at": "2026-08-27",
      "raw_retained": false,
      "records_received": 269,
      "resource_id": "fund_profile",
      "source_id": "TWSE_OGL_ETF"
    }
  ],
  "schema_version": "1.1.0",
  "slug": "cathay-esg-high-dividend",
  "symbol": "00878",
  "used_in_signal": false,
  "warnings": [
    "Point-in-time revision history is incomplete.",
    "Snapshot facts and evidence assessment are not used to calculate or upgrade research attitudes.",
    "No automatic refresh schedule is enabled."
  ]
}
